{
  "$schema": "http://json-schema.org/draft-07/schema#",
  "$id": "npbdd.seasonal_coefficients.json",
  "title": "NPBDD Seasonal Coefficients (monthly shares of annual deaths)",
  "type": "object",
  "required": ["updated_at", "method", "monthly_share", "cumulative_share"],
  "properties": {
    "updated_at": {"type": "string", "format": "date"},
    "method": {"type": "string"},
    "monthly_share": {
      "type": "object",
      "required": ["1","2","3","4","5","6","7","8","9","10","11","12"],
      "patternProperties": {
        "^([1-9]|1[0-2])$": {"type": "number", "minimum": 0, "maximum": 1}
      },
      "additionalProperties": false
    },
    "cumulative_share": {
      "type": "object",
      "required": ["1","2","3","4","5","6","7","8","9","10","11","12"],
      "patternProperties": {
        "^([1-9]|1[0-2])$": {"type": "number", "minimum": 0, "maximum": 1}
      },
      "additionalProperties": false
    }
  },
  "additionalProperties": false
}
