{
  "updated_at": "2026-08-01",
  "method": "среднее по 30 регион-годам из data/history/",
  "monthly_share": {
    "1": 0.0671,
    "2": 0.0676,
    "3": 0.0575,
    "4": 0.0647,
    "5": 0.0752,
    "6": 0.083,
    "7": 0.0985,
    "8": 0.104,
    "9": 0.0996,
    "10": 0.0957,
    "11": 0.0929,
    "12": 0.0943
  },
  "cumulative_share": {
    "1": 0.0671,
    "2": 0.1347,
    "3": 0.1922,
    "4": 0.2569,
    "5": 0.3321,
    "6": 0.4151,
    "7": 0.5136,
    "8": 0.6176,
    "9": 0.7172,
    "10": 0.8129,
    "11": 0.9058,
    "12": 1.0001
  }
}